{
  "timeframe": "1m",
  "generated_at": "2026-02-18T20:10:00Z",
  "cues": [
    {
      "cue": {
        "pair_id": "PI_XBTUSD__PI_ETHUSD",
        "left_instrument": "PI_XBTUSD",
        "right_instrument": "PI_ETHUSD",
        "timeframe": "1m",
        "regime": "CALM",
        "selected_variant": "ROBUST_Z",
        "direction_hint": "LONG_SPREAD",
        "spread_z": -2.11,
        "opportunity_score": 7.42,
        "confidence_band": "MEDIUM",
        "entry_band": 1.8,
        "exit_band": 0.6,
        "stop_band": 3.2,
        "expected_hold_bars": 18,
        "cost_estimate_bps": 0.6,
        "setup_actionable": true,
        "actionable": true,
        "rationale_codes": [],
        "setup_gate": {
          "status": "AVAILABLE",
          "pass": true,
          "rationale_codes": []
        },
        "cost_gate": {
          "status": "AVAILABLE",
          "expected_edge_bps": 5.11,
          "fee_bps": 1.2,
          "funding_model": "DYNAMIC",
          "funding_events": 0,
          "funding_bps_per_event": 0.6,
          "funding_bps": 0.3,
          "slippage_bps": 1.84,
          "net_edge_bps": 4.08,
          "pass": true,
          "rationale_codes": ["PERFORMANCE_GATE_SOURCE_PAPER_TRADES", "SLIPPAGE_SOURCE_SAMPLED"]
        },
        "trade_gate": {
          "status": "AVAILABLE",
          "pass": true,
          "blocked_by": "NONE",
          "rationale_codes": []
        },
        "portfolio_hint": {
          "status": "AVAILABLE",
          "target_weight": 0.31,
          "risk_contribution": 0.52,
          "cap_applied": false,
          "rationale_codes": []
        },
        "shadow_ml": {
          "status": "AVAILABLE",
          "model_name": "LOGISTIC_V1",
          "training_rows": 512,
          "positive_rate": 0.54,
          "precision": 0.67,
          "brier_score": 0.21,
          "recommended_variant": "ROBUST_Z",
          "recommended_probability": 0.72,
          "agrees_with_selected": true,
          "rationale_codes": []
        },
        "selected_signal_config": {
          "variant": "ROBUST_Z",
          "entry_band": 1.8,
          "exit_band": 0.6,
          "stop_band": 3.2,
          "lookback_bars": 520,
          "hold_bars": 20,
          "max_half_life_bars": 120.0,
          "train_bars": 64800,
          "validation_bars": 30240,
          "source": "AUTO_CHAMPION",
          "updated_at": "2026-02-18T20:09:00Z"
        },
        "evaluated_at": "2026-02-18T20:09:00Z"
      },
      "variants": [
        {
          "variant": "COINTEGRATION_Z",
          "score_last": -1.95,
          "sample_count": 21,
          "win_rate": 0.57,
          "edge_bps": 6.13,
          "reliability": 0.75,
          "regime_fit": 1.0,
          "opportunity_score": 6.63,
          "shadow_success_probability": 0.64,
          "shadow_rank_score": 7.26,
          "rationale_codes": []
        },
        {
          "variant": "ROBUST_Z",
          "score_last": -2.08,
          "sample_count": 24,
          "win_rate": 0.62,
          "edge_bps": 6.8,
          "reliability": 0.82,
          "regime_fit": 0.9,
          "opportunity_score": 7.42,
          "shadow_success_probability": 0.72,
          "shadow_rank_score": 9.06,
          "rationale_codes": []
        }
      ],
      "half_life_bars": 15.4,
      "hedge_ratio": 1.13,
      "hedge_ratio_stability": 0.12
    }
  ],
  "candidate_set": {
    "total_pairs": 3,
    "evaluated_pairs": 3,
    "actionable_pairs": 1,
    "cost_gate_pass_pairs": 1,
    "shadow_disagreement_pairs": 0
  },
  "portfolio_plan": {
    "status": "AVAILABLE",
    "weights": [
      {
        "pair_id": "PI_XBTUSD__PI_ETHUSD",
        "target_weight": 0.31,
        "risk_contribution": 0.52,
        "cap_applied": false
      },
      {
        "pair_id": "PI_SOLUSD__PI_ETHUSD",
        "target_weight": -0.29,
        "risk_contribution": 0.48,
        "cap_applied": false
      }
    ],
    "constraints": {
      "dollar_neutral": true,
      "gross_cap": 1.0,
      "per_pair_cap": 0.35
    },
    "rationale_codes": []
  },
  "skipped": []
}
